{
  "$schema": "../../../token.schema.json",
  "name": "Ether",
  "symbol": "ETH",
  "decimals": 18,
  "coingeckoId": "ethereum",
  "native": true,
  "tokens": {
    "ethereum": {
      "address": "0x0000000000000000000000000000000000000000"
    },
    "sepolia": {
      "address": "0x0000000000000000000000000000000000000000"
    },
    "bob": {
      "address": "0x0000000000000000000000000000000000000000"
    },
    "bob-sepolia": {
      "address": "0x0000000000000000000000000000000000000000"
    },
    "arbitrum-one": {
      "address": "0x0000000000000000000000000000000000000000"
    },
    "base": {
      "address": "0x0000000000000000000000000000000000000000"
    },
    "unichain": {
      "address": "0x0000000000000000000000000000000000000000"
    },
    "op-mainnet": {
      "address": "0x0000000000000000000000000000000000000000"
    },
    "soneium-mainnet": {
      "address": "0x0000000000000000000000000000000000000000"
    },
    "bnb-smart-chain": {
      "name": "Ethereum Token",
      "native": false,
      "address": "0x2170Ed0880ac9A755fd29B2688956BD959F933F8"
    },
    "robinhood-chain": {
      "address": "0x0000000000000000000000000000000000000000"
    }
  }
}
