{
  "$schema": "../../../token.schema.json",
  "name": "Trump Media & Technology Group • Robinhood Token",
  "symbol": "DJT",
  "decimals": 18,
  "coingeckoId": "trump-media-technology-group-corp-robinhood-token",
  "tokens": {
    "robinhood-chain": {
      "address": "0x1D11f0496982706C5e14A514D4E79F2e6BdE4516",
      "overrides": {
        "name": "Trump Media & Technology Group"
      }
    }
  }
}
