{
  "$schema": "../../../token.schema.json",
  "name": "Staked Frax Ether",
  "symbol": "sfrxETH",
  "decimals": 18,
  "coingeckoId": "staked-frax-ether",
  "website": "https://frax.finance/",
  "description": "sfrxETH is the version of frxETH which accrues staking yield. All profit generated from Frax Ether validators is distributed to sfrxETH holders. By exchanging frxETH for sfrxETH, one become's eligible for staking yield, which is redeemed upon converting sfrxETH back to frxETH.",
  "twitter": "@fraxfinance",
  "tokens": {
    "ethereum": {
      "address": "0xac3E018457B222d93114458476f3E3416Abbe38F",
      "bridge": {
        "bob": "0x3F6cE1b36e5120BBc59D0cFe8A5aC8b6464ac1f7"
      }
    },
    "bob": {
      "address": "0x249d2952D1C678843e7cD7bF654EfCeC52f2F9E8",
      "bridge": {
        "ethereum": "0x4200000000000000000000000000000000000010"
      }
    }
  }
}
