{
  "$schema": "../../../token.schema.json",
  "name": "UPS • Robinhood Token",
  "symbol": "UPS",
  "decimals": 18,
  "coingeckoId": "ups-robinhood-tokenized-stock",
  "tokens": {
    "robinhood-chain": {
      "address": "0xf23250dac154D05Bb671CB0d0eBEf3c635c79CE2",
      "overrides": {
        "name": "UPS"
      }
    }
  }
}
