{
  "$schema": "../../../token.schema.json",
  "name": "Coinbase Wrapped BTC",
  "symbol": "cbBTC",
  "decimals": 8,
  "coingeckoId": "coinbase-wrapped-btc",
  "tokens": {
    "ethereum": {
      "address": "0xcbB7C0000aB88B473b1f5aFd9ef808440eed33Bf"
    },
    "arbitrum-one": {
      "address": "0xcbb7c0000ab88b473b1f5afd9ef808440eed33bf"
    },
    "base": {
      "address": "0xcbB7C0000aB88B473b1f5aFd9ef808440eed33Bf"
    },
    "solana": {
      "address": "cbbtcf3aa214zXHbiAZQwf4122FBYbraNdFqgw4iMij"
    },
    "robinhood-chain": {
      "address": "0xCEC185eB182c47d1bA1EFc84e6959e18cd620Be4"
    }
  }
}
