{
  "$schema": "../../../token.schema.json",
  "name": "Wrapped Ether",
  "symbol": "WETH",
  "decimals": 18,
  "coingeckoId": "weth",
  "tokens": {
    "ethereum": {
      "address": "0xC02aaA39b223FE8D0A0e5C4F27eAD9083C756Cc2",
      "bridge": {
        "bob": "0x3F6cE1b36e5120BBc59D0cFe8A5aC8b6464ac1f7"
      }
    },
    "sepolia": {
      "address": "0x7b79995e5f793A07Bc00c21412e50Ecae098E7f9"
    },
    "bob": {
      "address": "0x4200000000000000000000000000000000000006",
      "bridge": {
        "ethereum": "0x4200000000000000000000000000000000000010"
      }
    },
    "bob-sepolia": {
      "address": "0x4200000000000000000000000000000000000006"
    },
    "op-mainnet": {
      "address": "0x4200000000000000000000000000000000000006"
    },
    "base": {
      "address": "0x4200000000000000000000000000000000000006"
    },
    "arbitrum-one": {
      "address": "0x82aF49447D8a07e3bd95BD0d56f35241523fBab1"
    },
    "polygon": {
      "address": "0x7ceB23fD6bC0adD59E62ac25578270cFf1b9f619"
    },
    "unichain": {
      "address": "0x4200000000000000000000000000000000000006"
    },
    "soneium-mainnet": {
      "address": "0x4200000000000000000000000000000000000006"
    },
    "berachain": {
      "name": "WETH",
      "address": "0x2F6F07CDcf3588944Bf4C42aC74ff24bF56e7590"
    },
    "sonic": {
      "name": "Wrapped Ether on Sonic",
      "address": "0x50c42dEAcD8Fc9773493ED674b675bE577f2634b"
    },
    "sei-network": {
      "name": "WETH",
      "address": "0x160345fC359604fC6e70E3c5fAcbdE5F7A9342d8"
    },
    "robinhood-chain": {
      "name": "WETH",
      "address": "0x0Bd7D308f8E1639FAb988df18A8011f41EAcAD73"
    }
  }
}
