{
  "$schema": "../../../token.schema.json",
  "name": "Reddit • Robinhood Token",
  "symbol": "RDDT",
  "decimals": 18,
  "coingeckoId": "reddit-robinhood-tokenized-stock",
  "tokens": {
    "robinhood-chain": {
      "address": "0x05b37Fb53A299a1b874A619e1c4C404D52C36F4C",
      "overrides": {
        "name": "Reddit"
      }
    }
  }
}
